{
  "decisionId": "sc002-YYYY-MM-DDTHH:MM:SSZ",
  "featureRef": "009-raise-pass-improvement-ratio",
  "sc002Status": "NotMet",
  "numerator": 1,
  "denominator": 2,
  "ratioPct": 50.0,
  "evaluatedAt": "2026-04-06T00:00:00Z",
  "ledgerRef": "specs/009-raise-pass-improvement-ratio/artifacts/improvement-ratio-ledger.json",
  "evidenceSet": [
    "specs/009-raise-pass-improvement-ratio/artifacts/improvement-ratio-ledger.json"
  ],
  "unmitigatedRegressionPasses": [],
  "notes": "Use Unresolved only when evidence is missing or conflicting."
}

