{
  "decisionId": "sc002-2026-04-06T00:50:00Z",
  "featureRef": "009-raise-pass-improvement-ratio",
  "sc002Status": "Met",
  "numerator": 9,
  "denominator": 10,
  "ratioPct": 90.0,
  "evaluatedAt": "2026-04-06T00:50:00Z",
  "ledgerRef": "specs/009-raise-pass-improvement-ratio/artifacts/improvement-ratio-ledger.json",
  "evidenceSet": [
    "specs/009-raise-pass-improvement-ratio/artifacts/improvement-ratio-ledger.json",
    "specs/009-raise-pass-improvement-ratio/artifacts/pass-03/recovery-pass-artifact.json",
    "specs/009-raise-pass-improvement-ratio/artifacts/pass-03/recovery-pass-artifact.json#artifacts",
    "specs/009-raise-pass-improvement-ratio/artifacts/pass-03/recovery-pass-artifact.json#gates",
    "specs/009-raise-pass-improvement-ratio/artifacts/pass-03/recovery-pass-artifact.json#metricEvidence",
    "specs/009-raise-pass-improvement-ratio/artifacts/pass-04/recovery-pass-artifact.json",
    "specs/009-raise-pass-improvement-ratio/artifacts/pass-04/recovery-pass-artifact.json#artifacts",
    "specs/009-raise-pass-improvement-ratio/artifacts/pass-04/recovery-pass-artifact.json#gates",
    "specs/009-raise-pass-improvement-ratio/artifacts/pass-04/recovery-pass-artifact.json#metricEvidence",
    "specs/009-raise-pass-improvement-ratio/artifacts/pass-05/recovery-pass-artifact.json",
    "specs/009-raise-pass-improvement-ratio/artifacts/pass-05/recovery-pass-artifact.json#artifacts",
    "specs/009-raise-pass-improvement-ratio/artifacts/pass-05/recovery-pass-artifact.json#gates",
    "specs/009-raise-pass-improvement-ratio/artifacts/pass-05/recovery-pass-artifact.json#metricEvidence",
    "specs/009-raise-pass-improvement-ratio/artifacts/pass-06/recovery-pass-artifact.json",
    "specs/009-raise-pass-improvement-ratio/artifacts/pass-06/recovery-pass-artifact.json#artifacts",
    "specs/009-raise-pass-improvement-ratio/artifacts/pass-06/recovery-pass-artifact.json#gates",
    "specs/009-raise-pass-improvement-ratio/artifacts/pass-06/recovery-pass-artifact.json#metricEvidence",
    "specs/009-raise-pass-improvement-ratio/artifacts/pass-07/recovery-pass-artifact.json",
    "specs/009-raise-pass-improvement-ratio/artifacts/pass-07/recovery-pass-artifact.json#artifacts",
    "specs/009-raise-pass-improvement-ratio/artifacts/pass-07/recovery-pass-artifact.json#gates",
    "specs/009-raise-pass-improvement-ratio/artifacts/pass-07/recovery-pass-artifact.json#metricEvidence",
    "specs/009-raise-pass-improvement-ratio/artifacts/pass-08/recovery-pass-artifact.json",
    "specs/009-raise-pass-improvement-ratio/artifacts/pass-08/recovery-pass-artifact.json#artifacts",
    "specs/009-raise-pass-improvement-ratio/artifacts/pass-08/recovery-pass-artifact.json#gates",
    "specs/009-raise-pass-improvement-ratio/artifacts/pass-08/recovery-pass-artifact.json#metricEvidence",
    "specs/009-raise-pass-improvement-ratio/artifacts/pass-09/recovery-pass-artifact.json",
    "specs/009-raise-pass-improvement-ratio/artifacts/pass-09/recovery-pass-artifact.json#artifacts",
    "specs/009-raise-pass-improvement-ratio/artifacts/pass-09/recovery-pass-artifact.json#gates",
    "specs/009-raise-pass-improvement-ratio/artifacts/pass-09/recovery-pass-artifact.json#metricEvidence",
    "specs/009-raise-pass-improvement-ratio/artifacts/pass-10/recovery-pass-artifact.json",
    "specs/009-raise-pass-improvement-ratio/artifacts/pass-10/recovery-pass-artifact.json#artifacts",
    "specs/009-raise-pass-improvement-ratio/artifacts/pass-10/recovery-pass-artifact.json#gates",
    "specs/009-raise-pass-improvement-ratio/artifacts/pass-10/recovery-pass-artifact.json#metricEvidence"
  ],
  "unmitigatedRegressionPasses": []
}
